{
  "uuid": "disk-usage@storage",
  "name": "Disk Usage",
  "description": "Monitor disk space usage with customizable mount points and warning thresholds",
  "author": "storage",
  "category": "hardware",
  "version": "1.0.0",
  "icon": null,
  "screenshot": null,
  "repo_url": "https://github.com/jtaw5649/waybar-disk-usage",
  "tags": [
    "disk",
    "storage",
    "space",
    "monitoring"
  ]
}
