{
  "uuid": "battery-status@power",
  "name": "Battery Status",
  "description": "Advanced battery indicator with time remaining, health status, and charging animation",
  "author": "power",
  "category": "system",
  "version": "1.0.0",
  "icon": null,
  "screenshot": null,
  "repo_url": "https://github.com/jtaw5649/waybar-battery-status",
  "tags": [
    "battery",
    "power",
    "laptop",
    "charging"
  ]
}
