{
  "uuid": "network-speed@network",
  "name": "Network Speed",
  "description": "Real-time upload/download speed monitor with graph tooltip",
  "author": "network",
  "category": "network",
  "version": "1.0.0",
  "icon": null,
  "screenshot": null,
  "repo_url": "https://github.com/jtaw5649/waybar-network-speed",
  "tags": [
    "network",
    "bandwidth",
    "speed",
    "monitoring"
  ]
}
